"Name","agentforce1__External_Id__c","agentforce1__Ignore_Triggers__c","agentforce1__Hierarchy_Changed__c","agentforce1__Schema_Changed__c","agentforce1__Instruction__c","agentforce1__Purpose_Description__c","agentforce1__Latest_Version__r.agentforce1__External_Id__c","agentforce1__Schema_Instruction__r.agentforce1__External_Id__c"
"Process Analyser (Forward & Backwards Lookups)","406bf323-fbcf-4f1f-8438-1a98de7d0b37","false","false","false","","Extracting a business process from a flowchart into a data structure containing a process object and a process step object that are linked together.","64706c12-0ab5-4b83-809b-880f11648c0a","6a5e4ab9-858b-4e59-be16-c2c7b3a9b654"
"Advanced Test Data Generator (Nested Records)","09f052f2-8399-4a33-9eed-4f14e279e790","false","false","false","","Extracting Account / Contact / Task information from the input data in order to create the Salesforce sObject records.","d4d82bd3-01d6-4e7f-9623-35764040981f","6a5e4ab9-858b-4e59-be16-c2c7b3a9b654"
"Agentforce Record Builder - Apex Test Class Example","28ac5d7e-6877-4f7b-80f3-43017110a9e8","false","false","false","","This is an implementation to test the Agentforce Record Builder data structure as an actual mapping. This creates a perfect test case that is org agnostic. It's a bit complex to comprehend when all put together because it tests itself on itself.","c12478f2-172c-4a6f-9e9d-6ad46c6d47c9","6a5e4ab9-858b-4e59-be16-c2c7b3a9b654"
"Basic Test Data Generator (Acc / Con / Cse / Opp / Tsk)","50e7954c-3a4c-4874-9879-f449ea922439","false","false","false","","This mapping is used to create some basic (themed or professional looking) test data based on the generated schema mapping.","52e032d1-d4bc-4801-8be2-731ed24536f1","6a5e4ab9-858b-4e59-be16-c2c7b3a9b654"
"Action Call Transcripts for Cases / Tasks / Opps","8ecec2da-c22e-4d20-9602-1f15d42b6e9c","false","false","false","","Analyse call transcript to extract potential opportunities, cases based on complaints, request or compliments as well as creating follow up tasks.","14dd6b5b-874c-4fa8-b88c-23c9a9828982","6a5e4ab9-858b-4e59-be16-c2c7b3a9b654"
"Analyse and score Incoming Emails for Spam","2ca7b407-82da-4a6c-8f20-0827b872a4fb","false","false","false","","Analyse incoming emails related to a case to see if they are actually spam emails. We give them a likely Score and reason on what to check for as well as a status.","1074271b-48ce-49fe-a8e8-df379ad17405","6a5e4ab9-858b-4e59-be16-c2c7b3a9b654"
"Shopping List Allergy Analysis (Receipt Analysis)","5ee26446-f8ec-4bdc-a6dd-a1119f987414","false","false","false","","Analyse a shopping list and extract allergy information, price information and other receipt information.","32f9289c-74db-4f96-8f94-1e503af71eea","6a5e4ab9-858b-4e59-be16-c2c7b3a9b654"
"Analyse Storm Damage to Electrical Equipment","bd2dfad5-9758-4dfb-8921-562a2b054d4c","false","false","false","","Analyse customer uploaded photos of electricity infrastructure damage caused by storms or accidents to create work orders.","293a85e4-397d-4d29-b798-c79d7ee4dde4","6a5e4ab9-858b-4e59-be16-c2c7b3a9b654"
